{
  "title": "At a glance - Readable Tarots",
  "requires-steamodded": true,
  "requires-talisman": false,
  "categories": [
    "Resource Packs"
  ],
  "author": "sas",
  "repo": "https://github.com/bosass/Readable-Tarots-Balatro-mod-",
  "downloadURL": "https://github.com/bosass/Readable-Tarots-Balatro-mod-/releases/latest/download/ReadableTarots.zip",
  "folderName": "ReadableTarots",
  "version": "1.2",
  "automatic-version-check": true,
  "last-updated": 1774886442
}
