{
  "title": "Fools-Pack",
  "requires-steamodded": true,
  "requires-talisman": true,
  "categories": [
    "Content"
  ],
  "author": "Kitsunare",
  "repo": "https://github.com/Kitsunare/Fools-Pack/",
  "downloadURL": "https://github.com/Kitsunare/Fools-Pack/releases/latest/download/Fools-Pack.zip",
  "folderName": "Fools-Pack",
  "version": "1.0.0",
  "automatic-version-check": true
}