{
  "title": "Shimmerberry",
  "requires-steamodded": true,
  "requires-talisman": false,
  "categories": [
    "Content",
    "Joker",
    "Miscellaneous"
  ],
  "author": "Flowire, unkokat",
  "repo": "https://github.com/FlowireXen/Shimmerberry",
  "downloadURL": "https://github.com/FlowireXen/Shimmerberry/archive/refs/heads/master.zip",
  "automatic-version-check": true,
  "version": "a94a109",
  "last-updated": 1787770124
}
