{
  "title": "Rofflatro",
  "requires-steamodded": true,
  "requires-talisman": false,
  "categories": [
    "Content",
    "Joker"
  ],
  "author": "Roffle's Chat",
  "repo": "https://github.com/MamiKeRiko/Rofflatro",
  "downloadURL": "https://github.com/MamiKeRiko/Rofflatro/archive/refs/tags/v1.1.3a.zip",
  "folderName": "Rofflatro",
  "version": "v1.1.3a",
  "automatic-version-check": true
}
