{
  "title": "pi_cubed's Jokers",
  "requires-steamodded": true,
  "requires-talisman": false,
  "categories": [
    "Joker"
  ],
  "author": "pi_cubed",
  "repo": "https://github.com/pi-cubed-cat/pi_cubeds_jokers",
  "downloadURL": "https://github.com/pi-cubed-cat/pi_cubeds_jokers/archive/refs/heads/main.zip",
  "version": "6c0347e",
  "automatic-version-check": true,
  "last-updated": 1786781762
}
