{
  "title": "Chase's Mod of Random Bullshit",
  "requires-steamodded": true,
  "requires-talisman": false,
  "categories": [
    "Content",
    "Joker"
  ],
  "author": "CrazyChase10",
  "repo": "https://github.com/chasebowling2010-svg/CMORB",
  "downloadURL": "http://github.com/chasebowling2010-svg/CMORB/releases/latest/download/chasesmodofrandombullshit.2.2.zip",
  "version": "1.0.0",
  "automatic-version-check": true,
  "fixed-release-tag-updates": false
}
