{
  "title": "SDM_0's Stuff",
  "requires-steamodded": true,
  "requires-talisman": false,
  "categories": [
    "Content",
    "Joker"
  ],
  "author": "SDM0",
  "repo": "https://github.com/SDM0/SDM_0-s-Stuff",
  "downloadURL": "https://github.com/SDM0/SDM_0-s-Stuff/archive/refs/heads/main.zip",
  "automatic-version-check": true,
  "version": "988681d"
}
