{
  "title": "UnBlind",
  "requires-steamodded": true,
  "requires-talisman": false,
  "categories": [
    "Quality of Life"
  ],
  "author": "MeraGenio",
  "repo": "https://github.com/MeraGenio/UnBlind",
  "downloadURL": "https://github.com/MeraGenio/UnBlind/archive/refs/tags/43230f4.zip",
  "automatic-version-check": true,
  "version": "43230f4",
  "last-updated": 1779548012
}
