{
  "title": "Wormhole",
  "requires-steamodded": true,
  "requires-talisman": false,
  "categories": [
    "Content"
  ],
  "author": "The Potato Patch Events Group",
  "repo": "https://github.com/Balatro-Potato-Patch/Wormhole",
  "downloadURL": "https://github.com/Balatro-Potato-Patch/Wormhole/archive/refs/tags/v1.0.7.zip",
  "version": "v1.0.7",
  "automatic-version-check": true,
  "last-updated": 1779222272
}
