{
  "title": "Cryptid-MoreMarioJokers",
  "requires-steamodded": true,
  "requires-talisman": true,
  "categories": [
    "Content",
    "Joker"
  ],
  "author": "SMG9000, Denverplays2, MarioFan597",
  "repo": "https://github.com/smg9000/Cryptid-MoreMarioJokers",
  "downloadURL": "https://github.com/smg9000/Cryptid-MoreMarioJokers/archive/refs/heads/main.zip",
  "folderName": "Cryptid-MoreMarioJokers",
  "version": "87c9aa4",
  "automatic-version-check": true,
  "last-updated": 1784272263
}
