{
  "title": "MinorArcana",
  "requires-steamodded": true,
  "requires-talisman": false,
  "categories": [
    "Content"
  ],
  "author": "Iva",
  "repo": "https://github.com/Prost0Iva/MinorArcana",
  "downloadURL": "https://github.com/Prost0Iva/MinorArcana/archive/refs/heads/main.zip",
  "version": "f209b88",
  "automatic-version-check": true,
  "fixed-release-tag-updates": false,
  "last-updated": 1789516199
}
